{
  "$schema": "http://json-schema.org/draft-07/schema#",
  "$id": "https://github.com/arkade-os/solver-registry/schema/card.schema.json",
  "title": "Solver card",
  "description": "One solver's market listing for one network. Path: solvers/<network>/<name>.json",
  "type": "object",
  "additionalProperties": false,
  "required": [
    "version",
    "name",
    "markets"
  ],
  "dependencies": {
    "sig": [
      "discovery_pubkey"
    ]
  },
  "definitions": {
    "asset": {
      "type": "object",
      "additionalProperties": false,
      "required": [
        "id",
        "name",
        "ticker",
        "precision"
      ],
      "properties": {
        "id": {
          "type": "string",
          "pattern": "^(btc|[0-9a-f]{68})$",
          "description": "Canonical asset identity: \"btc\" or a 68-hex-char AssetId."
        },
        "name": {
          "type": "string",
          "minLength": 1,
          "maxLength": 64
        },
        "ticker": {
          "type": "string",
          "minLength": 1,
          "maxLength": 16
        },
        "precision": {
          "type": "integer",
          "minimum": 0,
          "maximum": 18,
          "description": "Number of decimals: base-units per display unit = 10^precision."
        }
      }
    },
    "priceFeedSchema": {
      "type": "object",
      "additionalProperties": false,
      "required": [
        "type",
        "price_path"
      ],
      "properties": {
        "type": {
          "const": "json",
          "description": "The price feed response is JSON."
        },
        "price_path": {
          "type": "string",
          "pattern": "^(?:/(?:[^~/]|~0|~1)*)*$",
          "description": "RFC 6901 JSON Pointer to the numeric feed value, e.g. /price or /bitcoin/usd. Empty string selects the whole JSON document."
        }
      }
    }
  },
  "properties": {
    "version": {
      "const": 0
    },
    "name": {
      "type": "string",
      "pattern": "^[a-z0-9-]+$",
      "description": "Unique within the network directory; must equal the filename (without .json)."
    },
    "discovery_pubkey": {
      "type": "string",
      "pattern": "^[0-9a-f]{64}$",
      "description": "BIP340 x-only public key, lowercase hex."
    },
    "sig": {
      "type": "string",
      "pattern": "^[0-9a-f]{128}$",
      "description": "BIP340 Schnorr signature by discovery_pubkey over sha256(canonical_json)."
    },
    "markets": {
      "type": "array",
      "minItems": 1,
      "items": {
        "type": "object",
        "additionalProperties": false,
        "required": [
          "pair",
          "base_asset",
          "quote_asset",
          "price_feed",
          "price_feed_schema",
          "price_decimals",
          "fee_bps",
          "min_base_amount",
          "max_base_amount",
          "min_quote_amount",
          "max_quote_amount"
        ],
        "anyOf": [
          { "properties": { "max_base_amount": { "type": "integer", "minimum": 1 } } },
          { "properties": { "max_quote_amount": { "type": "integer", "minimum": 1 } } }
        ],
        "properties": {
          "pair": {
            "type": "string",
            "pattern": "^[A-Za-z0-9._-]{1,16}/[A-Za-z0-9._-]{1,16}$",
            "description": "Display pair \"<base-ticker>/<quote-ticker>\"; must equal base_asset.ticker + \"/\" + quote_asset.ticker. Canonical identity lives in base_asset.id / quote_asset.id."
          },
          "base_asset": {
            "$ref": "#/definitions/asset",
            "description": "Display metadata for the pair's base side."
          },
          "quote_asset": {
            "$ref": "#/definitions/asset",
            "description": "Display metadata for the pair's quote side."
          },
          "price_feed": {
            "type": "string",
            "format": "uri",
            "pattern": "^https://"
          },
          "price_feed_schema": {
            "$ref": "#/definitions/priceFeedSchema"
          },
          "price_decimals": {
            "type": "integer",
            "minimum": 0,
            "maximum": 18,
            "description": "The feed value divided by 10^price_decimals is the price in quote-atomic-units per base-atomic-unit."
          },
          "fee_bps": {
            "type": "integer",
            "minimum": 0,
            "maximum": 10000
          },
          "min_base_amount": {
            "type": "integer",
            "minimum": 0,
            "maximum": 9007199254740991,
            "description": "Lower trade-size bound for the base side, in base atomic units. An enabled side has 1 <= min <= max; when the side is disabled (max = 0) min MUST be 0."
          },
          "max_base_amount": {
            "type": "integer",
            "minimum": 0,
            "maximum": 9007199254740991,
            "description": "Upper trade-size bound for the base side, in base atomic units. 0 disables the side: the solver does not pay out base and makers cannot receive it."
          },
          "min_quote_amount": {
            "type": "integer",
            "minimum": 0,
            "maximum": 9007199254740991,
            "description": "Lower trade-size bound for the quote side, in quote atomic units. An enabled side has 1 <= min <= max; when the side is disabled (max = 0) min MUST be 0."
          },
          "max_quote_amount": {
            "type": "integer",
            "minimum": 0,
            "maximum": 9007199254740991,
            "description": "Upper trade-size bound for the quote side, in quote atomic units. 0 disables the side: the solver does not pay out quote and makers cannot receive it."
          }
        }
      }
    }
  }
}
