{
  "version": 0,
  "name": "signed-solver",
  "discovery_pubkey": "dff1d77f2a671c5f36183726db2341be58feae1da2deced843240f7b502ba659",
  "markets": [
    {
      "pair": "BTC/BTC",
      "base_asset": {
        "id": "btc",
        "name": "Bitcoin",
        "ticker": "BTC",
        "precision": 8
      },
      "quote_asset": {
        "id": "btc",
        "name": "Bitcoin",
        "ticker": "BTC",
        "precision": 8
      },
      "price_feed": "https://feed.example.com/price?pair=btcusd",
      "price_feed_schema": {
        "type": "json",
        "price_path": "/price"
      },
      "price_decimals": 8,
      "fee_bps": 25,
      "min_base_amount": 1000,
      "max_base_amount": 5000000,
      "min_quote_amount": 1000,
      "max_quote_amount": 5000000
    }
  ],
  "sig": "ee90ac02347db60301754ab6857c1c1fc377a9b800c10554a5a95ea7c36bb8970d08f80202fcaba7611cad7e89c8cc9c994da2161a1dd1f5ff1bb65bb6d75286"
}
